{
  "id": "vocab.a2.59",
  "lesson": "a2-59",
  "title": "Lesson Vocabulary",
  "words": [
    { "lemma": "kiállítás", "translation": "exhibition", "pos": "noun" },
    { "lemma": "fesztivál", "translation": "festival", "pos": "noun" },
    { "lemma": "belépő", "translation": "admission ticket", "pos": "noun" },
    { "lemma": "esemény", "translation": "event", "pos": "noun" },
    { "lemma": "helyszín", "translation": "venue, location", "pos": "noun" }
  ]
}
