{
  "id": "vocab.b1.gobiernosmilitares.03",
  "lesson": "b1-gobiernosmilitares-03",
  "title": "Chile",
  "words": [
    {
      "lemma": "derrocamiento",
      "translation": "overthrow",
      "pos": "noun"
    },
    {
      "lemma": "represión",
      "translation": "repression",
      "pos": "noun"
    },
    {
      "lemma": "desaparecido",
      "translation": "disappeared person",
      "pos": "noun"
    }
  ]
}