{
  "id": "vocab.b1.kiegyezes.04",
  "lesson": "b1-kiegyezes-04",
  "title": "Lesson Vocabulary",
  "words": [
    {
      "lemma": "dualizmus",
      "translation": "Dualism (Austro-Hungarian dual state structure)",
      "pos": "noun"
    },
    {
      "lemma": "közös ügyek",
      "translation": "common affairs (foreign policy, defense, finance)",
      "pos": "noun"
    },
    {
      "lemma": "önálló kormány",
      "translation": "autonomous / independent government",
      "pos": "noun"
    },
    {
      "lemma": "Andrássy Gyula",
      "translation": "Count Gyula Andrássy (prime minister)",
      "pos": "noun"
    },
    {
      "lemma": "alkotmányos monarchia",
      "translation": "constitutional monarchy",
      "pos": "noun"
    },
    {
      "lemma": "vámunió",
      "translation": "customs union between Austria and Hungary",
      "pos": "noun"
    },
    {
      "lemma": "kiegyezés",
      "translation": "the Compromise (of 1867); agreement",
      "pos": "noun"
    },
    {
      "lemma": "külügy",
      "translation": "foreign affairs",
      "pos": "noun"
    },
    {
      "lemma": "hadügy",
      "translation": "military affairs, defence",
      "pos": "noun"
    },
    {
      "lemma": "belügy",
      "translation": "home affairs, internal affairs",
      "pos": "noun"
    },
    {
      "lemma": "reális",
      "translation": "realistic",
      "pos": "adjective"
    },
    {
      "lemma": "maximum",
      "translation": "maximum",
      "pos": "noun"
    },
    {
      "lemma": "parlamenti",
      "translation": "parliamentary",
      "pos": "adjective"
    },
    {
      "lemma": "beleszólás",
      "translation": "say (in a decision), influence",
      "pos": "noun"
    },
    {
      "lemma": "vonatkozik",
      "translation": "to relate (to), to concern",
      "pos": "verb"
    },
    {
      "lemma": "vonatkozó",
      "translation": "relating to",
      "pos": "adjective"
    },
    {
      "lemma": "igazságszolgáltatás",
      "translation": "justice system, the courts",
      "pos": "noun"
    }
  ]
}
