{
  "id": "vocab.b2.25.05",
  "lesson": "b2-25-05",
  "title": "Resultative Judgments: Dar por + Participio",
  "words": [
    {
      "lemma": "presuposición",
      "translation": "presupposition / assumption",
      "pos": "noun"
    },
    {
      "lemma": "clausura",
      "translation": "closure / definitive shutting",
      "pos": "noun"
    },
    {
      "lemma": "estipulación",
      "translation": "stipulation / contractual term",
      "pos": "noun"
    },
    {
      "lemma": "asentimiento",
      "translation": "assent / agreement",
      "pos": "noun"
    },
    {
      "lemma": "veredicto",
      "translation": "verdict / formal ruling",
      "pos": "noun"
    },
    {
      "lemma": "liquidación",
      "translation": "settlement / liquidation",
      "pos": "noun"
    },
    {
      "lemma": "desestimación",
      "translation": "dismissal / rejection",
      "pos": "noun"
    },
    {
      "lemma": "constatación",
      "translation": "verification / factual confirmation",
      "pos": "noun"
    },
    {
      "lemma": "firmeza",
      "translation": "firmness / finality (legal)",
      "pos": "noun"
    },
    {
      "lemma": "conclusión",
      "translation": "conclusion / ending",
      "pos": "noun"
    }
  ]
}
