{
  "id": "vocab.a1.06",
  "lesson": "a1-06",
  "title": "Lesson Vocabulary",
  "words": [
    {
      "lemma": "jó reggelt",
      "translation": "good morning",
      "pos": "expression"
    },
    {
      "lemma": "jó napot",
      "translation": "good afternoon / good day",
      "pos": "expression"
    },
    {
      "lemma": "jó estét",
      "translation": "good evening",
      "pos": "expression"
    },
    {
      "lemma": "jó éjszakát",
      "translation": "good night",
      "pos": "expression"
    },
    {
      "lemma": "viszlát",
      "translation": "goodbye",
      "pos": "expression"
    }
  ]
}