{
  "id": "vocab.a2.90",
  "lesson": "a2-90",
  "title": "Lesson Vocabulary",
  "words": [
    { "lemma": "jobb", "translation": "better", "pos": "adjective" },
    { "lemma": "rosszabb", "translation": "worse", "pos": "adjective" },
    { "lemma": "változtat", "translation": "to change", "pos": "verb" },
    { "lemma": "cél", "translation": "goal", "pos": "noun" },
    { "lemma": "fokozatosan", "translation": "gradually", "pos": "adverb" }
  ]
}
