{
  "id": "vocab.b1.monarchia.03",
  "lesson": "b1-monarchia-03",
  "title": "Lesson Vocabulary",
  "words": [
    {
      "lemma": "metropolisz",
      "translation": "metropolis, large city (Budapest's rapid rise)",
      "pos": "noun"
    },
    {
      "lemma": "Nagykörút",
      "translation": "Grand Boulevard of Budapest",
      "pos": "noun"
    },
    {
      "lemma": "Országház építése",
      "translation": "construction of the Parliament building (Steindl Imre)",
      "pos": "noun"
    },
    {
      "lemma": "kávéházi kultúra",
      "translation": "urban coffeehouse culture (for example the New York Café)",
      "pos": "noun"
    },
    {
      "lemma": "polgárosodás",
      "translation": "bourgeois development, civic modernization",
      "pos": "noun"
    },
    {
      "lemma": "Dunaparti korzó",
      "translation": "Danube promenade in Pest",
      "pos": "noun"
    },
    {
      "lemma": "sétány",
      "translation": "promenade, walkway",
      "pos": "noun"
    },
    {
      "lemma": "lakosság",
      "translation": "population",
      "pos": "noun"
    },
    {
      "lemma": "délutánonként",
      "translation": "in the afternoons",
      "pos": "adverb"
    },
    {
      "lemma": "körüli",
      "translation": "around (adjective)",
      "pos": "adjective"
    },
    {
      "lemma": "parti",
      "translation": "on the bank, riverside",
      "pos": "adjective"
    }
  ]
}
