{
  "id": "vocab.b1.16.01",
  "lesson": "b1-16-01",
  "title": "Lesson Vocabulary",
  "words": [
    {
      "lemma": "környezetvédelem",
      "translation": "environmental protection",
      "pos": "noun"
    },
    {
      "lemma": "szelektív hulladékgyűjtés",
      "translation": "separate waste collection (sorting waste)",
      "pos": "noun"
    },
    {
      "lemma": "műanyaghulladék",
      "translation": "plastic waste",
      "pos": "noun"
    },
    {
      "lemma": "megújuló energia",
      "translation": "renewable energy",
      "pos": "noun"
    }
  ]
}
