{
  "id": "vocab.b1.mohacs.04",
  "lesson": "b1-mohacs-04",
  "title": "Lesson Vocabulary",
  "words": [
    {
      "lemma": "II. Lajos",
      "translation": "Louis II of Hungary",
      "pos": "noun"
    },
    {
      "lemma": "Csele-patak",
      "translation": "Csele brook",
      "pos": "noun"
    },
    {
      "lemma": "nehéz páncél",
      "translation": "heavy armor",
      "pos": "noun"
    },
    {
      "lemma": "fulladás",
      "translation": "drowning, suffocation",
      "pos": "noun"
    },
    {
      "lemma": "holttest",
      "translation": "corpse, body",
      "pos": "noun"
    },
    {
      "lemma": "menekülés",
      "translation": "escape, flight",
      "pos": "noun"
    },
    {
      "lemma": "trónörökös",
      "translation": "heir to the throne",
      "pos": "noun"
    },
    {
      "lemma": "dinasztikus válság",
      "translation": "dynastic crisis",
      "pos": "noun"
    },
    {
      "lemma": "fullad",
      "translation": "to drown, to suffocate",
      "pos": "verb"
    },
    {
      "lemma": "sáros",
      "translation": "muddy",
      "pos": "adjective"
    },
    {
      "lemma": "kimenekül",
      "translation": "to escape (out of somewhere)",
      "pos": "verb"
    },
    {
      "lemma": "megöl",
      "translation": "to kill",
      "pos": "verb"
    },
    {
      "lemma": "Esztergom",
      "translation": "Esztergom (town on the Danube)",
      "pos": "noun"
    },
    {
      "lemma": "hazatér",
      "translation": "to return home",
      "pos": "verb"
    }
  ]
}
