{
  "id": "vocab.a1.133",
  "lesson": "a1-133",
  "title": "Lesson Vocabulary",
  "words": [
    {
      "lemma": "innen",
      "translation": "from here",
      "pos": "adverb"
    },
    {
      "lemma": "kilométer",
      "translation": "kilometre",
      "pos": "noun"
    },
    {
      "lemma": "gyalog",
      "translation": "on foot",
      "pos": "adverb"
    }
  ]
}
