{
  "id": "vocab.b1.ccse.autonomias.inst.05",
  "lesson": "b1-ccse-autonomias-inst-05",
  "title": "Provincias, Diputaciones e Islas",
  "words": [
    {
      "lemma": "diputación provincial",
      "translation": "provincial council",
      "pos": "expression"
    },
    {
      "lemma": "cabildo",
      "translation": "island council (Canary Islands)",
      "pos": "noun"
    },
    {
      "lemma": "consejo insular",
      "translation": "island council (Balearic Islands)",
      "pos": "expression"
    },
    {
      "lemma": "uniprovincial",
      "translation": "single-province (autonomous community)",
      "pos": "adjective"
    },
    {
      "lemma": "corporación",
      "translation": "corporation / local authority body",
      "pos": "noun"
    }
  ]
}
