{
  "id": "vocab.a2.207",
  "lesson": "a2-207",
  "title": "Lesson Vocabulary",
  "words": [
    {
      "lemma": "ajánlott levél",
      "translation": "registered letter",
      "pos": "noun"
    },
    {
      "lemma": "tértivevény",
      "translation": "advice of delivery / return receipt",
      "pos": "noun"
    },
    {
      "lemma": "feladóvevény",
      "translation": "certificate of posting",
      "pos": "noun"
    },
    {
      "lemma": "feladó",
      "translation": "sender",
      "pos": "noun"
    },
    {
      "lemma": "címzett",
      "translation": "recipient / addressee",
      "pos": "noun"
    },
    {
      "lemma": "irányítószám",
      "translation": "postal code",
      "pos": "noun"
    },
    {
      "lemma": "aláír",
      "translation": "to sign",
      "pos": "verb"
    },
    {
      "lemma": "kitölt",
      "translation": "to fill out (a form)",
      "pos": "verb"
    },
    {
      "lemma": "hivatalos",
      "translation": "official / formal",
      "pos": "adjective"
    },
    {
      "lemma": "küldemény",
      "translation": "postal item / consignment",
      "pos": "noun"
    },
    {
      "lemma": "feladás",
      "translation": "posting / sending off",
      "pos": "noun"
    },
    {
      "lemma": "őriz",
      "translation": "to keep / safeguard",
      "pos": "verb"
    },
    {
      "lemma": "követ",
      "translation": "to follow / track",
      "pos": "verb"
    },
    {
      "lemma": "honlap",
      "translation": "website",
      "pos": "noun"
    },
    {
      "lemma": "kézbesítés",
      "translation": "delivery",
      "pos": "noun"
    }
  ]
}
